{
  "$schema": "https://json-schema.org/draft/2020-12/schema",
  "$id": "https://www.clawbotomy.com/evidence/schema/integrity.v1.schema.json",
  "title": "Clawbotomy bundle integrity v1",
  "type": "object",
  "additionalProperties": false,
  "required": ["schemaId", "algorithm", "files", "bundleDigest"],
  "properties": {
    "schemaId": { "const": "clawbotomy.integrity/v1" },
    "algorithm": { "const": "sha256" },
    "files": {
      "type": "object",
      "additionalProperties": false,
      "required": ["manifest.json", "cases.jsonl", "summary.json"],
      "properties": {
        "manifest.json": { "$ref": "#/$defs/file" },
        "cases.jsonl": { "$ref": "#/$defs/file" },
        "summary.json": { "$ref": "#/$defs/file" }
      }
    },
    "bundleDigest": { "type": "string", "pattern": "^[a-f0-9]{64}$" }
  },
  "$defs": {
    "file": {
      "type": "object",
      "additionalProperties": false,
      "required": ["sha256", "bytes"],
      "properties": {
        "sha256": { "type": "string", "pattern": "^[a-f0-9]{64}$" },
        "bytes": { "type": "integer", "minimum": 0 }
      }
    }
  }
}
